Month	Port	event_type	note	source
2022-01	Ashdod	ocr_gate_go_live	HCT Phase-A start; proxy for OCR gate activation (Camco project)	IPC 2024 financial report (Phase-A start 2022-01-17); Camco HCT project
2022-01	Ashdod	tos_go_live	HCT TOS go-live aligned to Phase-A operational start	IPC 2024 financial report (Phase-A start 2022-01-17)
2020-06	Haifa	tos_go_live	HPC N4 migration go-live	BusinessWire/Navis + Hellenic Shipping News (2020-06-17/19)
2021-05	Haifa	tos_upgrade	HPC N4 3.7 upgrade	Ship-Technology (2021-05-11)
2021-09	Haifa	ocr_gate_go_live	Bayport operations start; proxy for OCR gate activation (Camco project award 2020)	INSS & JewishPolicyCenter; Camco Bayport project
2021-09	Haifa	tos_go_live	Bayport TOS go-live (SIPG TOS) aligned to operations start	INSS; EU Parliament study on SIPG TOS
